Lea State,LEA,School State,School,ID,Year,Category,Total,With State Certification,American Indian or Alaska Native,Asian,Hawaiian/ Pacific Islander,Hispanic,Black,White,Two or more races,Total Students,SWD (IDEA-Eligible),LEP
GA,Richmond County,GA,Blythe Elementary School,130438001532,2015,Classroom Teachers,20.00,20.00,,,,,,,,,,
GA,Richmond County,GA,Blythe Elementary School,130438001532,2015,Classroom teachers in their first year of teaching,1.00,,,,,,,,,,,
GA,Richmond County,GA,Blythe Elementary School,130438001532,2015,Classroom teachers in their second year of teaching,1.00,,,,,,,,,,,
GA,Richmond County,GA,Blythe Elementary School,130438001532,2015,Teachers absent more than 10 days of the school year,6.00,,,,,,,,,,,
GA,Richmond County,GA,Blythe Elementary School,130438001532,2015,Teachers employed during current school year,20.00,,,,,,,,,,,
GA,Richmond County,GA,Blythe Elementary School,130438001532,2015,Teachers employed during both the current and previous school year,17.00,,,,,,,,,,,
GA,Richmond County,GA,Blythe Elementary School,130438001532,2015,High-School Counselors,1.00,,,,,,,,,,,
GA,Richmond County,GA,Blythe Elementary School,130438001532,2015,Total enrollment,,,0.00,2.00,4.00,19.00,88.00,175.00,10.00,298.00,38.00,10.00

