Lea State,LEA,School State,School,ID,Year,Category,Total,With State Certification,American Indian or Alaska Native,Asian,Hawaiian/ Pacific Islander,Hispanic,Black,White,Two or more races,Total Students,SWD (IDEA-Eligible),LEP
GA,McDuffie County,GA,Dearing Elementary School,130357002140,2015,Classroom Teachers,36.51,36.51,,,,,,,,,,
GA,McDuffie County,GA,Dearing Elementary School,130357002140,2015,Classroom teachers in their first year of teaching,2.00,,,,,,,,,,,
GA,McDuffie County,GA,Dearing Elementary School,130357002140,2015,Classroom teachers in their second year of teaching,1.00,,,,,,,,,,,
GA,McDuffie County,GA,Dearing Elementary School,130357002140,2015,Teachers absent more than 10 days of the school year,9.00,,,,,,,,,,,
GA,McDuffie County,GA,Dearing Elementary School,130357002140,2015,Teachers employed during current school year,38.00,,,,,,,,,,,
GA,McDuffie County,GA,Dearing Elementary School,130357002140,2015,Teachers employed during both the current and previous school year,33.00,,,,,,,,,,,
GA,McDuffie County,GA,Dearing Elementary School,130357002140,2015,High-School Counselors,1.00,,,,,,,,,,,
GA,McDuffie County,GA,Dearing Elementary School,130357002140,2015,Total enrollment,,,4.00,0.00,0.00,58.00,121.00,316.00,43.00,542.00,65.00,31.00

