Lea State,LEA,School State,School,ID,Year,Category,Total,With State Certification,American Indian or Alaska Native,Asian,Hawaiian/ Pacific Islander,Hispanic,Black,White,Two or more races,Total Students,SWD (IDEA-Eligible),LEP
GA,Chattooga County,GA,Menlo Elementary School,130108000421,2015,Classroom Teachers,23.77,22.77,,,,,,,,,,
GA,Chattooga County,GA,Menlo Elementary School,130108000421,2015,Classroom teachers in their first year of teaching,2.00,,,,,,,,,,,
GA,Chattooga County,GA,Menlo Elementary School,130108000421,2015,Classroom teachers in their second year of teaching,0.00,,,,,,,,,,,
GA,Chattooga County,GA,Menlo Elementary School,130108000421,2015,Teachers absent more than 10 days of the school year,11.00,,,,,,,,,,,
GA,Chattooga County,GA,Menlo Elementary School,130108000421,2015,Teachers employed during current school year,28.00,,,,,,,,,,,
GA,Chattooga County,GA,Menlo Elementary School,130108000421,2015,Teachers employed during both the current and previous school year,25.00,,,,,,,,,,,
GA,Chattooga County,GA,Menlo Elementary School,130108000421,2015,High-School Counselors,0.50,,,,,,,,,,,
GA,Chattooga County,GA,Menlo Elementary School,130108000421,2015,Total enrollment,,,2.00,4.00,0.00,7.00,4.00,319.00,10.00,346.00,32.00,2.00

